{
  "command": "istioctl",
  "hash-url": {
    "sha256": "https://github.com/istio/istio/releases/download/${VERSION}/istioctl-${VERSION}-win.zip.sha256"
  },
  "name": "istioctl",
  "scripts": {
    "install": [
      "_unzip $filename C:\\bin\\"
    ],
    "test": "printInfo istioctl $(istioctl version  --remote=false -s) install success",
    "uninstall": "_cleanup C:\\bin\\istioctl.exe",
    "version": "istioctl version  --remote=false -s"
  },
  "url": "https://github.com/istio/istio/releases/download/${VERSION}/istioctl-${VERSION}-win.zip",
  "version": "1.7.0",
  "pre-version": "1.8.0-alpha.2"
}
