{
  "github": "cloudflare/cfssl",
  "name": "cfssl",
  "path": [
    "C:\\bin"
  ],
  "releases": "https://github.com/cloudflare/cfssl/releases",
  "scripts": {
    "install": "$url = \"https://github.com/cloudflare/cfssl/releases/download/v${VERSION}\"\n$pkgs='cfssl','cfssl-bundle','cfssl-certinfo','cfssl-newkey','cfssl-scan','cfssljson','mkbundle','multirootca'\nforeach($pkg in $pkgs){\n  printInfo Downloading $pkg ...\n\n  if($_isWindows){\n    $dist=\"C:\\bin\\${pkg}.exe\"\n  }else{\n    $dist=\"/usr/local/bin/${pkg}\"\n  }\n\n  if(Test-Path $dist){\n    printTips $pkg exists`, skip\n    continue;\n  }\n\n  if($_isWindows){\n    curl -fsSL $url/${pkg}_${VERSION}_${env:lwpm_os}_${env:lwpm_architecture}$(if($_isWindows){echo .exe}) -o $dist\n  }else{\n    printInfo \"Download from $url/${pkg}_${VERSION}_${env:lwpm_os}_${env:lwpm_architecture}$(if($_isWindows){echo .exe})\"\n    sudo curl -fsSL $url/${pkg}_${VERSION}_${env:lwpm_os}_${env:lwpm_architecture}$(if($_isWindows){echo .exe}) -o $dist\n    sudo chmod +x $dist\n  }\n\n}\n",
    "test": "cfssl version"
  },
  "version": "1.6.5"
}
