{
  "name": "go",
  "description": "Go is an open source programming language that makes it easy to build simple, reliable, and efficient software",
  "version": "1.24.4",
  "pre-version": "1.24.4",
  "homepage": "https://golang.google.cn/",
  "bug": "https://github.com/golang/go/issues",
  "github": "golang/go",
  "releases": "https://github.com/golang/go/releases",
  "url": "https://dl.google.com/go/go${VERSION}.${env:lwpm_os}-${env:lwpm_architecture}.$(if($IsWindows){echo zip}else{echo tar.gz})",
  "command": "go",
  "scripts": {
    "version": "($(go version) -split ' ')[2].trim('go')",
    "test": "printInfo $(go version) install success",
    "install": [
      "if($IsWindows){_cleanup C:\\go\\src ; _unzip $filename C:\\}else{sudo rm -rf /usr/local/go/src ; sudo mkdir -p /usr/local ; sudo tar -zxf $filename -C /usr/local/ ; sudo ln -sf /usr/local/go/bin/* /usr/local/bin/}"
    ],
    "uninstall": "if($IsWindows){_cleanup C:\\go}else{sudo rm -rf /usr/local/go}"
  },
  "path": [
    "C:\\go\\bin",
    "$HOME\\go\\bin"
  ]
}
