{
  "name": "zeal",
  "description": "Offline documentation browser inspired by Dash",
  "version": "0.7.2",
  "pre-version": "0.7.2",
  "homepage": "https://zealdocs.org/",
  "bug": "https://github.com/zealdocs/zeal/issues",
  "github": "zealdocs/zeal",
  "releases": "https://github.com/zealdocs/zeal/releases",
  "url": "https://github.com/zealdocs/zeal/releases/download/v${VERSION}/zeal-${VERSION}-windows-x64.msi",
  "url-mirror": "https://${env:GITHUB_MIRROR}/zealdocs/zeal/releases/download/v${VERSION}/zeal-${VERSION}-windows-x64.msi",
  "command": "${env:ProgramFiles}\\Zeal\\zeal.exe",
  "scripts": {
    "install": "Start-Process -FilePath 'C:\\windows\\system32\\msiexec.exe' -ArgumentList \"/i $filename /passive\" -Wait",
    "test": "ls 'C:\\Program Files\\Zeal\\zeal.exe'",
    "version": "echo ${VERSION}",
    "platform-reqs": [
      "PrintTips Only support windows",
      "echo $True",
      "if(!$IsWindows){echo $False}"
    ]
  }
}
