{
  "name": "idea",
  "description": "Manage your tools the easy way",
  "version": "2.6.3.43718",
  "pre-version": "2.6.3.43718",
  "homepage": "https://www.jetbrains.com/",
  "bug": "",
  "github": "",
  "releases": "https://github.com/microsoft/winget-pkgs/tree/master/manifests/j/JetBrains/Toolbox",
  "url": "https://download.jetbrains.com/toolbox/jetbrains-toolbox-${VERSION}.$(if($IsWindows){echo exe}else{echo dmg})",
  "command": "${env:APPDATA}\\..\\Local\\JetBrains\\Toolbox\\bin\\jetbrains-toolbox.exe",
  "scripts": {
    "install": [
      "Start-Process -FilePath $filename -wait"
    ],
    "test": "if($IsWindows){get-command ${env:APPDATA}\\..\\Local\\JetBrains\\Toolbox\\bin\\jetbrains-toolbox.exe}",
    "version": [
      "$version = (get-command ${env:APPDATA}\\..\\Local\\JetBrains\\Toolbox\\bin\\jetbrains-toolbox.exe).Version",
      "${version}.trim('.0')"
    ],
    "platform-reqs": [
      "if($IsLinux){echo $False}"
    ],
    "uninstall": "& $env:APPDATA\\..\\Local\\JetBrains\\Toolbox\\bin\\Uninstall.exe"
  },
  "$comment": [
    "https://www.jetbrains.com/toolbox-app/"
  ]
}
