{
  "name": "composer",
  "description": "Dependency Manager for PHP",
  "version": "2.10.3",
  "pre-version": "2.10.3",
  "homepage": "https://getcomposer.org/",
  "bug": "https://github.com/composer/composer/issues",
  "github": "composer/composer",
  "releases": "https://getcomposer.org/download/",
  "url": "https://github.com/composer/composer/releases/download/${VERSION}/composer.phar",
  "url-mirror": "https://mirrors.aliyun.com/composer/composer.phar",
  "command": "composer",
  "download-filename": "composer-${VERSION}.phar",
  "scripts": {
    "version": "(composer --version).split(' ')[2]",
    "install": [
      "if($isWindows){_mkdir \"$env:ProgramData\\ComposerSetup\\bin\\\"}",
      "if($isWindows){Copy-item -r -force \"$env:LWPM_PKG_ROOT\\dist\\composer\"      \"$env:ProgramData\\ComposerSetup\\bin\\\"}",
      "if($isWindows){Copy-item -r -force \"$env:LWPM_PKG_ROOT\\dist\\composer.ps1\"  \"$env:ProgramData\\ComposerSetup\\bin\\\"}",
      "if($isWindows){Copy-item -r -force \"$env:LWPM_PKG_ROOT\\dist\\composer.bat\"  \"$env:ProgramData\\ComposerSetup\\bin\\\"}",
      "if($isWindows){Copy-item -r -force $filename                                   \"$env:ProgramData\\ComposerSetup\\bin\\composer.phar\"}",
      "if(!$IsWindows){sudo install -m755 $filename /usr/local/bin/composer}"
    ],
    "test": [
      "printInfo $(composer --version) install success"
    ],
    "uninstall": [
      "_sudo remove-item -r -force $env:ProgramData\\ComposerSetup"
    ],
    "pruneuninstall": [
      "_cleanup \"$HOME\\AppData\\Roaming\\Composer\"",
      "_cleanup \"$HOME\\AppData\\Local\\Composer\""
    ]
  },
  "path": [
    "$env:ProgramData\\ComposerSetup\\bin\\",
    "$HOME\\AppData\\Roaming\\Composer\\vendor\\bin"
  ]
}
