{
  "bug": "",
  "command": "python",
  "description": "Python is a programming language that lets you work quickly and integrate systems more effectively",
  "github": "python/cpython",
  "homepage": "https://www.python.org/",
  "name": "python",
  "path": [
    "${env:ProgramData}\\Python",
    "${env:ProgramData}\\Python\\Scripts"
  ],
  "pre-url": "https://www.python.org/ftp/python/${VERSION}/python-${VERSION}-${env:lwpm_architecture}.exe",
  "pre-url-mirror": "https://repo.huaweicloud.com/python/${VERSION}/python-${VERSION}-${env:lwpm_architecture}.exe",
  "pre-version": "3.13.0",
  "releases": "https://www.python.org/downloads/",
  "scripts": {
    "install": [
      "# https://docs.python.org/3.7/using/windows.html#installing-without-ui\n\nStart-Process $filename -Wait `\n-ArgumentList @( `\n  '/quiet', `\n  'InstallAllUsers=1', `\n  \"DefaultAllUsersTargetDir=${env:ProgramData}\\Python\", `\n  \"DefaultJustForMeTargetDir=${env:ProgramData}\\Python\", `\n  \"TargetDir=${env:ProgramData}\\Python\", `\n  'PrependPath=1', `\n  'Shortcuts=0', `\n  'Include_doc=0', `\n  'Include_pip=1', `\n  'Include_test=0' `\n);"
    ],
    "platform-reqs": "if(!$IsWindows){echo $False}",
    "test": "python --version",
    "version": "($(python --version) -split \" \")[1]"
  },
  "url": "https://www.python.org/ftp/python/${VERSION}/python-${VERSION}-${env:lwpm_architecture}.exe",
  "url-mirror": "https://repo.huaweicloud.com/python/${VERSION}/python-${VERSION}-${env:lwpm_architecture}.exe",
  "version": "3.13.0"
}
