{
  "name": "mpv",
  "description": "Video player based on MPlayer/mplayer2",
  "version": "0.39.0",
  "pre-version": "20250615-git-e8ade13",
  "homepage": "https://mpv.io/",
  "bug": "https://mpv.io/bug-reports/",
  "github": "mpv-player/mpv",
  "releases": "https://github.com/mpv-player/mpv/releases",
  "url": "https://downloads.sourceforge.net/project/mpv-player-windows/release/mpv-${VERSION}-x86_64-v3.7z",
  "pre-url": "https://downloads.sourceforge.net/project/mpv-player-windows/64bit-v3/mpv-x86_64-v3-${VERSION}.7z",
  "path": [
    "$env:ProgramData\\mpv"
  ],
  "command": "mpv",
  "scripts": {
    "install": [
      "# https://sourceforge.net/projects/mpv-player-windows/files/",
      "_mkdir ${env:ProgramData}/mpv",
      "powershell -c \"7z x $filename -aoa -r -o${env:ProgramData}/mpv\"",
      "_ln ${env:ProgramData}\\mpv\\mpv.exe $HOME\\Desktop\\mpv.exe"
    ],
    "version": "# (mpv).split()[1]\n echo ${VERSION}",
    "test": "printInfo mpv $((mpv).split()[1]) install success",
    "uninstall": "_cleanup $env:ProgramData\\mpv"
  }
}
