{
  "name": "kubernetes-server",
  "platform": [
    {
      "architecture": "amd64",
      "os": "linux"
    },
    {
      "architecture": "arm64",
      "os": "linux"
    }
  ],
  "scripts": {
    "platform-reqs": [
      "if(!$IsLinux){echo $False}"
    ],
    "dist": "_mkdir $env:LWPM_PKG_ROOT/dist/${env:lwpm_os}-${env:lwpm_architecture}\n\ncurl -L `\n  $url `\n  -o $env:LWPM_PKG_ROOT/dist/${env:lwpm_os}-${env:lwpm_architecture}/$filename\n"
  },
  "url": "https://dl.k8s.io/release/v${VERSION}/kubernetes-server-${env:lwpm_os}-${env:lwpm_architecture}.tar.gz",
  "version": "1.35.0"
}
