{
  "name": "s6",
  "platform": [
    {
      "os": "linux",
      "architecture": "amd64"
    }
  ],
  "scripts": {
    "install": "sudo tar -zxf $filename -C /",
    "platform-reqs": "if(!$_IsLinux){echo $false}"
  },
  "url": "https://github.com/just-containers/s6-overlay/releases/download/v${VERSION}/s6-overlay-x86_64.tar.xz",
  "url-mirror": "https://${env:GITHUB_MIRROR}/just-containers/s6-overlay/releases/download/v${VERSION}/s6-overlay-x86_64.tar.xz",
  "version": "3.2.3.2"
}
