{
  "name": "git",
  "description": "Git is a free and open source distributed version control system designed to handle everything from small to very large projects with speed and efficiency",
  "version": "2.50.0",
  "pre-version": "2.50.0",
  "homepage": "https://git-scm.com/",
  "bug": "https://git-scm.com/community",
  "github": "git/git",
  "releases": "https://github.com/git/git/tags",
  "pre-url" : "",
  "url": "https://github.com/git-for-windows/git/releases/download/v${VERSION}.windows.1/Git-${VERSION}-64-bit.exe",
  "url-mirror":"https://mirrors.huaweicloud.com/git-for-windows/v${VERSION}.windows.1/Git-${VERSION}-64-bit.exe",
  "command": "git",
  "scripts": {
    "platform-reqs": [
      "if(!$IsWindows){echo $False}"
    ],
    "version": "(git --version).split(' ')[2].trim('.1').trim('.windows')",
    "install": [
      "Start-Process -FilePath $filename -wait"
    ],
    "test": "printInfo $(git --version) install success",
    "uninstall": "& $env:ProgramFiles\\Git\\unins001.exe"
  }
}
