{
  "command": "crictl",
  "name": "crictl",
  "platform": [
    {
      "architecture": "amd64",
      "os": "windows"
    },
    {
      "architecture": "amd64",
      "os": "linux"
    },
    {
      "architecture": "arm64",
      "os": "linux"
    },
    {
      "architecture": "arm",
      "os": "linux"
    }
  ],
  "scripts": {
    "dist": "_mkdir $env:LWPM_PKG_ROOT/dist/${env:lwpm_os}-${env:lwpm_architecture}\n\ncurl -L `\n  $url `\n  -o $env:LWPM_PKG_ROOT/dist/${env:lwpm_os}-${env:lwpm_architecture}/$filename\n",
    "install": "if($IsWindows){tar -zxf $filename -C C:\\bin}else{sudo tar -zxf $filename -C /usr/local/bin}",
    "platform-reqs": "if($IsMacOs){echo $False}",
    "test": "crictl --version",
    "uninstall": "_cleanup C:\\bin\\crictl.exe",
    "version": "(crictl --version).split(' ')[2].trim('v')"
  },
  "url": "https://github.com/kubernetes-sigs/cri-tools/releases/download/v${VERSION}/crictl-v${VERSION}-${env:lwpm_os}-${env:lwpm_architecture}.tar.gz",
  "url-mirror": "https://${env:GITHUB_MIRROR}/kubernetes-sigs/cri-tools/releases/download/v${VERSION}/crictl-v${VERSION}-${env:lwpm_os}-${env:lwpm_architecture}.tar.gz",
  "version": "1.37.0"
}
