{
  "name": "vclib",
  "description": "Microsoft Visual C++ Redistributable for Visual Studio 2019",
  "version": "16.2.0",
  "pre-version": "16.2.0",
  "homepage": "https://support.microsoft.com/zh-cn/help/2977003/the-latest-supported-visual-c-downloads",
  "bug": "",
  "github": "",
  "releases": "",
  "url": "https://aka.ms/vs/16/release/VC_redist.x64.exe",
  "$comment": [
    "https://support.microsoft.com/zh-cn/help/2977003/the-latest-supported-visual-c-downloads",
    "https://www.microsoft.com/en-us/download/details.aspx?id=40784"
  ],
  "scripts": {
    "platform-reqs": "if(!$IsWindows){echo $False}",
    "install": [
      "Start-Process -FilePath $filename -wait"
    ]
  }
}
